{
  "schemaVersion": 1,
  "release": "2026-09-18-pilot-r1",
  "generatedAt": "2026-09-20T13:29:06.959Z",
  "assets": [
    {
      "id": "ph:material:aerial_rocks_02",
      "sourceId": "aerial_rocks_02",
      "kind": "material",
      "name": "Aerial Rocks 02",
      "source": "polyhaven",
      "license": "CC0-1.0",
      "revision": "2026-09-18-pilot-r1",
      "manifestUrl": "/polyhaven/releases/2026-09-18-pilot-r1/manifests/material-aerial_rocks_02.json",
      "thumbnailUrl": "/polyhaven/releases/2026-09-18-pilot-r1/assets/materials/aerial_rocks_02/preview.webp",
      "categoryId": "bf84369c-cc7c-5347-ad17-173353e859b8",
      "categoryPath": "Stone/Rock & Cliffs/Rough Rock Faces",
      "categorySlugPath": "stone/rock-and-cliffs/rough-rock-faces",
      "ancestorCategoryIds": [],
      "legacyCategories": [
        "terrain",
        "outdoor",
        "natural",
        "rock",
        "aerial"
      ],
      "tags": [
        "rocks",
        "rough",
        "moss",
        "cliff",
        "rock face",
        "cave"
      ],
      "attributes": {
        "surface_use": "ground",
        "condition": [
          "mossy",
          "weathered"
        ],
        "origin": "natural",
        "setting": "outdoor",
        "aerial": true,
        "sourceFilesHash": "76c3c2d202e28839b72e336a5b1839e58e2da2e3"
      },
      "availableTiers": [
        "1k",
        "2k"
      ],
      "hasHeight": true
    },
    {
      "id": "ph:material:asphalt_02",
      "sourceId": "asphalt_02",
      "kind": "material",
      "name": "Asphalt 02",
      "source": "polyhaven",
      "license": "CC0-1.0",
      "revision": "2026-09-18-pilot-r1",
      "manifestUrl": "/polyhaven/releases/2026-09-18-pilot-r1/manifests/material-asphalt_02.json",
      "thumbnailUrl": "/polyhaven/releases/2026-09-18-pilot-r1/assets/materials/asphalt_02/preview.webp",
      "categoryId": "ae6df066-2cbf-5772-9092-3cd86ed6394e",
      "categoryPath": "Asphalt & Bitumen/Asphalt/Cracked Asphalt",
      "categorySlugPath": "asphalt-and-bitumen/asphalt/cracked-asphalt",
      "ancestorCategoryIds": [],
      "legacyCategories": [
        "terrain",
        "road",
        "man made",
        "outdoor",
        "floor"
      ],
      "tags": [
        "asphalt",
        "cracked",
        "flat",
        "road",
        "asphalt road",
        "tarmac road",
        "gritty",
        "weathered",
        "grey",
        "cracking",
        "tar",
        "cracks"
      ],
      "attributes": {
        "surface_use": "floor",
        "condition": [
          "weathered",
          "cracked"
        ],
        "origin": "man_made",
        "setting": "outdoor",
        "sourceFilesHash": "2839a331f389f6ad1e30a78f24db58369d92f742"
      },
      "availableTiers": [
        "1k",
        "2k"
      ],
      "hasHeight": true
    },
    {
      "id": "ph:material:box_profile_metal_sheet",
      "sourceId": "box_profile_metal_sheet",
      "kind": "material",
      "name": "Box Profile Metal Sheet",
      "source": "polyhaven",
      "license": "CC0-1.0",
      "revision": "2026-09-18-pilot-r1",
      "manifestUrl": "/polyhaven/releases/2026-09-18-pilot-r1/manifests/material-box_profile_metal_sheet.json",
      "thumbnailUrl": "/polyhaven/releases/2026-09-18-pilot-r1/assets/materials/box_profile_metal_sheet/preview.webp",
      "categoryId": "c10ee76b-cb81-546f-bba9-095bf5a18a6d",
      "categoryPath": "Metal/Sheet & Corrugated/Corrugated Iron",
      "categorySlugPath": "metal/sheet-and-corrugated/corrugated-iron",
      "ancestorCategoryIds": [],
      "legacyCategories": [
        "wall",
        "outdoor",
        "roofing"
      ],
      "tags": [
        "sheet",
        "metal sheet",
        "box profile",
        "industrial",
        "corrugated",
        "steel",
        "red",
        "roofing material",
        "metal roofing sheet",
        "galvanized steel",
        "corrugated iron"
      ],
      "attributes": {
        "surface_use": "roof",
        "condition": [
          "painted",
          "weathered"
        ],
        "origin": "man_made",
        "setting": "outdoor",
        "sourceFilesHash": "f57400cd2f30b0b2ed4a54c1fd645fe835eb60f2"
      },
      "availableTiers": [
        "1k",
        "2k"
      ],
      "hasHeight": true
    },
    {
      "id": "ph:material:brick_gravel",
      "sourceId": "brick_gravel",
      "kind": "material",
      "name": "Brick Gravel",
      "source": "polyhaven",
      "license": "CC0-1.0",
      "revision": "2026-09-18-pilot-r1",
      "manifestUrl": "/polyhaven/releases/2026-09-18-pilot-r1/manifests/material-brick_gravel.json",
      "thumbnailUrl": "/polyhaven/releases/2026-09-18-pilot-r1/assets/materials/brick_gravel/preview.webp",
      "categoryId": "ff767449-ea44-5527-96f0-d74aa52df2d0",
      "categoryPath": "Ground & Terrain/Gravel & Pebbles/Crushed Aggregate",
      "categorySlugPath": "ground-and-terrain/gravel-and-pebbles/crushed-aggregate",
      "ancestorCategoryIds": [],
      "legacyCategories": [
        "outdoor",
        "gravel",
        "brick"
      ],
      "tags": [
        "rough",
        "uneven",
        "brick",
        "gravel",
        "broken pieces",
        "rubble",
        "fragmented",
        "crushed",
        "aggregate",
        "terracotta"
      ],
      "attributes": {
        "surface_use": "ground",
        "condition": [
          "damaged"
        ],
        "origin": "man_made",
        "setting": "outdoor",
        "sourceFilesHash": "047c561b95f0a53e69ca4083501a9b21eaced364"
      },
      "availableTiers": [
        "1k",
        "2k"
      ],
      "hasHeight": true
    },
    {
      "id": "ph:material:brick_wall_001",
      "sourceId": "brick_wall_001",
      "kind": "material",
      "name": "Brick Wall 001",
      "source": "polyhaven",
      "license": "CC0-1.0",
      "revision": "2026-09-18-pilot-r1",
      "manifestUrl": "/polyhaven/releases/2026-09-18-pilot-r1/manifests/material-brick_wall_001.json",
      "thumbnailUrl": "/polyhaven/releases/2026-09-18-pilot-r1/assets/materials/brick_wall_001/preview.webp",
      "categoryId": "9ef0955b-87fa-5826-aa87-98b047ad9143",
      "categoryPath": "Brick & Block/Clay Brick/Running-Bond",
      "categorySlugPath": "brick-and-block/clay-brick/running-bond",
      "ancestorCategoryIds": [],
      "legacyCategories": [
        "brick",
        "man made",
        "outdoor",
        "indoor",
        "clean",
        "wall"
      ],
      "tags": [
        "red",
        "rough",
        "industrial",
        "plain",
        "baked"
      ],
      "attributes": {
        "surface_use": "wall",
        "condition": [
          "weathered",
          "worn",
          "damaged"
        ],
        "origin": "man_made",
        "setting": "either",
        "sourceFilesHash": "fd60577b22b011e4f5ae6ac5b2ffddd8dacf9b3d"
      },
      "availableTiers": [
        "1k",
        "2k"
      ],
      "hasHeight": true
    },
    {
      "id": "ph:material:brown_planks_03",
      "sourceId": "brown_planks_03",
      "kind": "material",
      "name": "Brown Planks 03",
      "source": "polyhaven",
      "license": "CC0-1.0",
      "revision": "2026-09-18-pilot-r1",
      "manifestUrl": "/polyhaven/releases/2026-09-18-pilot-r1/manifests/material-brown_planks_03.json",
      "thumbnailUrl": "/polyhaven/releases/2026-09-18-pilot-r1/assets/materials/brown_planks_03/preview.webp",
      "categoryId": "30ac2613-5076-5364-b4da-130117ad592d",
      "categoryPath": "Wood/Boards & Planks/Weathered Planks",
      "categorySlugPath": "wood/boards-and-planks/weathered-planks",
      "ancestorCategoryIds": [],
      "legacyCategories": [
        "wood",
        "man made",
        "indoor",
        "outdoor",
        "clean",
        "wall"
      ],
      "tags": [
        "planks",
        "untreated",
        "boat",
        "costal",
        "dry",
        "old",
        "withered"
      ],
      "attributes": {
        "surface_use": "wall",
        "condition": [
          "weathered"
        ],
        "origin": "man_made",
        "setting": "either",
        "sourceFilesHash": "dc9ddbd1646f29747e9571f5bf7abd7a28975a80"
      },
      "availableTiers": [
        "1k",
        "2k"
      ],
      "hasHeight": true
    },
    {
      "id": "ph:material:clay_roof_tiles",
      "sourceId": "clay_roof_tiles",
      "kind": "material",
      "name": "Clay Roof Tiles",
      "source": "polyhaven",
      "license": "CC0-1.0",
      "revision": "2026-09-18-pilot-r1",
      "manifestUrl": "/polyhaven/releases/2026-09-18-pilot-r1/manifests/material-clay_roof_tiles.json",
      "thumbnailUrl": "/polyhaven/releases/2026-09-18-pilot-r1/assets/materials/clay_roof_tiles/preview.webp",
      "categoryId": "6165a492-c53c-5b5f-96df-20c96a7763df",
      "categoryPath": "Ceramic/Terracotta",
      "categorySlugPath": "ceramic/terracotta",
      "ancestorCategoryIds": [],
      "legacyCategories": [
        "roofing"
      ],
      "tags": [
        "weathered",
        "rough",
        "worn",
        "uneven",
        "discolored",
        "clay",
        "roof",
        "roofing",
        "tile roofing",
        "exterior"
      ],
      "attributes": {
        "surface_use": "roof",
        "condition": [
          "weathered",
          "worn",
          "damaged"
        ],
        "origin": "man_made",
        "setting": "outdoor",
        "sourceFilesHash": "045b0a54a86afd93f6571c76296aa2df436a4328"
      },
      "availableTiers": [
        "1k",
        "2k"
      ],
      "hasHeight": true
    },
    {
      "id": "ph:material:cobblestone_01",
      "sourceId": "cobblestone_01",
      "kind": "material",
      "name": "Cobblestone 01",
      "source": "polyhaven",
      "license": "CC0-1.0",
      "revision": "2026-09-18-pilot-r1",
      "manifestUrl": "/polyhaven/releases/2026-09-18-pilot-r1/manifests/material-cobblestone_01.json",